{
  "object_type": "delivery_payload",
  "payload_ref": "delivery_payload:project-cn-open-001:2",
  "project_id": "project-cn-open-001",
  "fact_version": 2,
  "source_project_fact_ref": "project_fact:project-cn-open-001:2",
  "sales_context_ref": "sales_context:project-cn-open-001:2",
  "contact_context_ref": "contact_context:project-cn-open-001:2",
  "report_record_ref": "report_record:report-open-001",
  "sale_gate_status": "OPEN",
  "coverage_sellable_state": "SELLABLE",
  "delivery_risk_state": "OPEN",
  "review_status": "CONFIRMED",
  "report_status": "ISSUED",
  "delivery_readiness": "ready",
  "fact_summary": "Project is open for standard downstream sales and delivery consumption.",
  "risk_summary": "No blocking or hold condition remains after confirmation.",
  "payload_summary": "Delivery payload is ready based on coverage SELLABLE, delivery risk OPEN, sale gate OPEN, and report status ISSUED."
}
